{"definitions":[{"deckLimits":{"groups":[],"sameName":4},"definitionId":"cn:machine:pokemon:bo-huang-zi:a0fe526a","implementation":{"status":"verified","testIds":["tests/cn-cards/machine.test.mjs"],"tier":"machine"},"kind":"pokemon","mechanics":{"abilities":[],"attacks":[{"attackId":"cn:machine:pokemon:bo-huang-zi:a0fe526a:a1","cost":["Water"],"effects":[],"name":"啄","printedDamage":{"operator":"fixed","value":30},"sourceOfTruth":[{"kind":"card-library","sourceId":"library:CS5.5C/023_066"}]}],"effects":[],"evolvesFrom":"bo-jia-man","hp":90,"prizeCount":1,"resistance":null,"retreatCost":1,"ruleBox":false,"stage":"stage1","tags":[],"types":["Water"],"weakness":{"operation":"multiply","type":"Lightning","value":2}},"name":"波皇子","nameKey":"bo-huang-zi","ruleset":{"region":"CN","version":"V20261019"},"schemaVersion":"1.0.0","sourceOfTruth":[{"kind":"card-library","sourceId":"library:CS5.5C/023_066"}]},{"deckLimits":{"groups":[],"sameName":4},"definitionId":"cn:machine:pokemon:hao-li:d8f3205f","implementation":{"status":"verified","testIds":["tests/cn-cards/machine.test.mjs"],"tier":"machine"},"kind":"pokemon","mechanics":{"abilities":[],"attacks":[{"attackId":"cn:machine:pokemon:hao-li:d8f3205f:a1","cost":["Fighting"],"effects":[],"name":"怪力","printedDamage":{"operator":"fixed","value":30},"sourceOfTruth":[{"kind":"card-library","sourceId":"library:CS5.5C/044_066"}]},{"attackId":"cn:machine:pokemon:hao-li:d8f3205f:a2","cost":["Fighting","Fighting"],"effects":[],"name":"地球上投","printedDamage":{"operator":"fixed","value":50},"sourceOfTruth":[{"kind":"card-library","sourceId":"library:CS5.5C/044_066"}]}],"effects":[],"evolvesFrom":"wan-li","hp":100,"prizeCount":1,"resistance":null,"retreatCost":2,"ruleBox":false,"stage":"stage1","tags":[],"types":["Fighting"],"weakness":{"operation":"multiply","type":"Psychic","value":2}},"name":"豪力","nameKey":"hao-li","ruleset":{"region":"CN","version":"V20261019"},"schemaVersion":"1.0.0","sourceOfTruth":[{"kind":"card-library","sourceId":"library:CS5.5C/044_066"}]},{"deckLimits":{"groups":[],"sameName":4},"definitionId":"cn:machine:pokemon:jie-ni-gui:d5401372","implementation":{"status":"verified","testIds":["tests/cn-cards/machine.test.mjs"],"tier":"machine"},"kind":"pokemon","mechanics":{"abilities":[],"attacks":[{"attackId":"cn:machine:pokemon:jie-ni-gui:d5401372:a1","cost":["Water"],"effects":[],"name":"水枪","printedDamage":{"operator":"fixed","value":20},"sourceOfTruth":[{"kind":"card-library","sourceId":"library:CS5.5C/012_066"}]}],"effects":[],"evolvesFrom":null,"hp":70,"prizeCount":1,"resistance":null,"retreatCost":1,"ruleBox":false,"stage":"basic","tags":[],"types":["Water"],"weakness":{"operation":"multiply","type":"Lightning","value":2}},"name":"杰尼龟","nameKey":"jie-ni-gui","ruleset":{"region":"CN","version":"V20261019"},"schemaVersion":"1.0.0","sourceOfTruth":[{"kind":"card-library","sourceId":"library:CS5.5C/012_066"}]},{"deckLimits":{"groups":[],"sameName":4},"definitionId":"cn:machine:pokemon:wan-li:d6955e43","implementation":{"status":"verified","testIds":["tests/cn-cards/machine.test.mjs"],"tier":"machine"},"kind":"pokemon","mechanics":{"abilities":[],"attacks":[{"attackId":"cn:machine:pokemon:wan-li:d6955e43:a1","cost":["Fighting"],"effects":[],"name":"重拳","printedDamage":{"operator":"fixed","value":20},"sourceOfTruth":[{"kind":"card-library","sourceId":"library:CS5.5C/043_066"}]}],"effects":[],"evolvesFrom":null,"hp":70,"prizeCount":1,"resistance":null,"retreatCost":2,"ruleBox":false,"stage":"basic","tags":[],"types":["Fighting"],"weakness":{"operation":"multiply","type":"Psychic","value":2}},"name":"腕力","nameKey":"wan-li","ruleset":{"region":"CN","version":"V20261019"},"schemaVersion":"1.0.0","sourceOfTruth":[{"kind":"card-library","sourceId":"library:CS5.5C/043_066"}]}],"printings":[{"definitionBindings":[{"definitionId":"cn:machine:pokemon:jie-ni-gui:d5401372","ruleset":{"region":"CN","version":"V20261019"},"sourceOfTruth":[{"kind":"card-library","sourceId":"library:CS5.5C/012_066"}]}],"game":"tcg","identityReview":"machine","language":"zh-Hans","metadataRefs":[{"id":"library_v1:zh-Hans/CS5.5C/012_066","provider":"other","revision":"image-sha256:ab60350e13528122814b753000b25efd08cb8b73774e6a667beff069b5d053ec"}],"number":"012/066","printingId":"zh-Hans:CS5.5C:012/066","regulationMark":"F","releasedOn":"2024-08-02","schemaVersion":"1.0.0","series":"sword-shield","setCode":"CS5.5C"},{"definitionBindings":[{"definitionId":"cn:machine:pokemon:bo-huang-zi:a0fe526a","ruleset":{"region":"CN","version":"V20261019"},"sourceOfTruth":[{"kind":"card-library","sourceId":"library:CS5.5C/023_066"}]}],"game":"tcg","identityReview":"machine","language":"zh-Hans","metadataRefs":[{"id":"library_v1:zh-Hans/CS5.5C/023_066","provider":"other","revision":"image-sha256:956f57e02f9fd761a5c5110477c788bd1d10623460d36586dd3e4f9456747ab8"}],"number":"023/066","printingId":"zh-Hans:CS5.5C:023/066","regulationMark":"F","releasedOn":"2024-08-02","schemaVersion":"1.0.0","series":"sword-shield","setCode":"CS5.5C"},{"definitionBindings":[{"definitionId":"cn:machine:pokemon:wan-li:d6955e43","ruleset":{"region":"CN","version":"V20261019"},"sourceOfTruth":[{"kind":"card-library","sourceId":"library:CS5.5C/043_066"}]}],"game":"tcg","identityReview":"machine","language":"zh-Hans","metadataRefs":[{"id":"library_v1:zh-Hans/CS5.5C/043_066","provider":"other","revision":"image-sha256:949bf181bd7bb6a0c05fa795b7e3f435671f24bbfefd055f20d4a5e7fcefff5e"}],"number":"043/066","printingId":"zh-Hans:CS5.5C:043/066","regulationMark":"F","releasedOn":"2024-08-02","schemaVersion":"1.0.0","series":"sword-shield","setCode":"CS5.5C"},{"definitionBindings":[{"definitionId":"cn:machine:pokemon:hao-li:d8f3205f","ruleset":{"region":"CN","version":"V20261019"},"sourceOfTruth":[{"kind":"card-library","sourceId":"library:CS5.5C/044_066"}]}],"game":"tcg","identityReview":"machine","language":"zh-Hans","metadataRefs":[{"id":"library_v1:zh-Hans/CS5.5C/044_066","provider":"other","revision":"image-sha256:0bada32e2264e243d88d872d31ed2834cc513839e340862254b6d9fc57eb765e"}],"number":"044/066","printingId":"zh-Hans:CS5.5C:044/066","regulationMark":"F","releasedOn":"2024-08-02","schemaVersion":"1.0.0","series":"sword-shield","setCode":"CS5.5C"}],"schemaVersion":"2.0.0","setCode":"CS5.5C","shardId":"CS5.5C","sources":{"library:CS5.5C/012_066":{"kind":"card-library","locator":"library_v1 zh-Hans/CS5.5C/012_066：卡面各字段由两个视觉模型读本机卡图，与 MIK、52Poké 文字逐字段核对（机器实现，未经人工逐张审核）","sourceId":"library:CS5.5C/012_066","url":"https://tcg.mik.moe/cards/CS5.5C/012"},"library:CS5.5C/023_066":{"kind":"card-library","locator":"library_v1 zh-Hans/CS5.5C/023_066：卡面各字段由两个视觉模型读本机卡图，与 MIK、52Poké 文字逐字段核对（机器实现，未经人工逐张审核）","sourceId":"library:CS5.5C/023_066","url":"https://tcg.mik.moe/cards/CS5.5C/023"},"library:CS5.5C/043_066":{"kind":"card-library","locator":"library_v1 zh-Hans/CS5.5C/043_066：卡面各字段由两个视觉模型读本机卡图，与 MIK、52Poké 文字逐字段核对（机器实现，未经人工逐张审核）","sourceId":"library:CS5.5C/043_066","url":"https://tcg.mik.moe/cards/CS5.5C/043"},"library:CS5.5C/044_066":{"kind":"card-library","locator":"library_v1 zh-Hans/CS5.5C/044_066：卡面各字段由两个视觉模型读本机卡图，与 MIK、52Poké 文字逐字段核对（机器实现，未经人工逐张审核）","sourceId":"library:CS5.5C/044_066","url":"https://tcg.mik.moe/cards/CS5.5C/044"}}}
