{"definitions":[{"deckLimits":{"groups":[],"sameName":4},"definitionId":"cn:machine:pokemon:xue-rong-e:09b124c7","implementation":{"status":"verified","testIds":["tests/cn-cards/machine.test.mjs","tests/cn-cards/machine-effects.test.mjs"],"tier":"machine"},"kind":"pokemon","mechanics":{"abilities":[{"abilityId":"cn:machine:pokemon:xue-rong-e:09b124c7:b1","effects":[{"effectId":"cn:machine:pokemon:xue-rong-e:09b124c7:b1:attach","handlerId":"cn.attachHand@1","parameters":{"benchOnly":true,"count":1,"optional":false,"recipient":{"kind":"pokemon","types":["Water"]},"type":"Water"},"sourceOfTruth":[{"kind":"card-library","sourceId":"library:CS1aC/026_135"}]}],"mode":"activated","name":"冰雪之舞","sourceOfTruth":[{"kind":"card-library","sourceId":"library:CS1aC/026_135"}],"usage":{"key":"cn:ability:machine-cabda8ec67a6b6c8c57d","limit":null,"period":"unlimited","scope":"pokemon"}}],"attacks":[{"attackId":"cn:machine:pokemon:xue-rong-e:09b124c7:a1","cost":["Water","Colorless"],"effects":[],"name":"极光束","printedDamage":{"operator":"fixed","value":30},"sourceOfTruth":[{"kind":"card-library","sourceId":"library:CS1aC/026_135"}]}],"effects":[],"evolvesFrom":"xue-tun-chong","hp":90,"prizeCount":1,"resistance":null,"retreatCost":2,"ruleBox":false,"stage":"stage1","tags":[],"types":["Water"],"weakness":{"operation":"multiply","type":"Metal","value":2}},"name":"雪绒蛾","nameKey":"xue-rong-e","ruleset":{"region":"CN","version":"V20261019"},"schemaVersion":"1.0.0","sourceOfTruth":[{"kind":"card-library","sourceId":"library:CS1aC/026_135"}]}],"printings":[{"definitionBindings":[{"definitionId":"cn:machine:pokemon:xue-rong-e:09b124c7","ruleset":{"region":"CN","version":"V20261019"},"sourceOfTruth":[{"kind":"card-library","sourceId":"library:CSGC/004_008"}]}],"game":"tcg","identityReview":"machine","language":"zh-Hans","metadataRefs":[{"id":"library_v1:zh-Hans/CSGC/004_008","provider":"other","revision":"image-sha256:a7e6fe255314fdcda3c6d90913158093a15b3d1bc0718cd2963fb7ac546af553"}],"number":"004/008","printingId":"zh-Hans:CSGC:004/008","regulationMark":"D","releasedOn":"2024-03-01","schemaVersion":"1.0.0","series":"sword-shield","setCode":"CSGC"}],"schemaVersion":"2.0.0","setCode":"CSGC","shardId":"CSGC","sources":{"library:CS1aC/026_135":{"kind":"card-library","locator":"library_v1 zh-Hans/CS1aC/026_135：卡面各字段由两个视觉模型读本机卡图，与 MIK、52Poké 文字逐字段核对（机器实现，未经人工逐张审核）","sourceId":"library:CS1aC/026_135","url":"https://tcg.mik.moe/cards/CS1aC/026"},"library:CSGC/004_008":{"kind":"card-library","locator":"library_v1 zh-Hans/CSGC/004_008：卡面各字段由两个视觉模型读本机卡图，与 MIK、52Poké 文字逐字段核对（机器实现，未经人工逐张审核）","sourceId":"library:CSGC/004_008","url":"https://tcg.mik.moe/cards/CSGC/004"}}}
