{"definitions":[{"deckLimits":{"groups":[],"sameName":4},"definitionId":"cn:trainer:switch","implementation":{"status":"verified","testIds":["tests/cn-cards/csvh1c-pikachu.test.mjs"]},"kind":"trainer","mechanics":{"category":"item","effects":[{"effectId":"cn:trainer:switch:switch","handlerId":"cn.switch@1","parameters":{"affected":"active","chooser":"self","side":"own"},"sourceOfTruth":[{"kind":"official-card","sourceId":"cn-card-face:CSVH1C:046-059"}]}]},"name":"宝可梦交替","nameKey":"switch","ruleset":{"region":"CN","version":"V20261019"},"schemaVersion":"1.0.0","sourceOfTruth":[{"kind":"official-card","sourceId":"cn-card-face:CSVH1C:046-059"}]}],"printings":[{"definitionBindings":[{"definitionId":"cn:trainer:switch","ruleset":{"region":"CN","version":"V20261019"},"sourceOfTruth":[{"kind":"card-library","sourceId":"library:CSMPdC/011_021"}]}],"game":"tcg","identityReview":"machine","language":"zh-Hans","metadataRefs":[{"id":"library_v1:zh-Hans/CSMPdC/011_021","provider":"other","revision":"image-sha256:6be8534c6bb9a8e743ff8d815e6b69d9c0d4c1ca5e5f44323004387d2c030df9"}],"number":"011/021","printingId":"zh-Hans:CSMPdC:011/021","regulationMark":"A","releasedOn":"2023-04-15","schemaVersion":"1.0.0","series":"sun-moon","setCode":"CSMPdC"}],"schemaVersion":"2.0.0","setCode":"CSMPdC","shardId":"CSMPdC","sources":{"cn-card-face:CSVH1C:046-059":{"kind":"official-card","locator":"宝可梦卡牌 嗨皮组合 皮卡丘&皮皮&草苗龟&索财灵 CSVH1C 046/059 宝可梦交替：卡面文字逐项核对本机卡图 library_v1/zh-Hans/CSVH1C/046/CSVH1C_046.png（SHA-256 eac5921eb7513c75b0dc576d4ad1a68748c02753f72ca3a8ab3283fd67887b53，图源 https://tcg.mik.moe/static/img/CSVH1C/046.png）及同目录 metadata.json；官方商品页确认所属商品「宝可梦卡牌 嗨皮组合 皮卡丘&皮皮&草苗龟&索财灵」与发售日 2025-01-17。","observedOn":"2026-10-21","sourceId":"cn-card-face:CSVH1C:046-059","url":"https://www.pokemon.cn/tcg/product/15585.html"},"library:CSMPdC/011_021":{"kind":"card-library","locator":"library_v1 zh-Hans/CSMPdC/011_021：卡面各字段由两个视觉模型读本机卡图，与 MIK、52Poké 文字逐字段核对（机器实现，未经人工逐张审核）","sourceId":"library:CSMPdC/011_021","url":"https://tcg.mik.moe/cards/CSMPdC/011"}}}
