{"definitions":[{"deckLimits":{"groups":[],"sameName":4},"definitionId":"cn:machine:pokemon:xiang-ri-zhong-zi:2f1a99cc","implementation":{"status":"verified","testIds":["tests/cn-cards/machine.test.mjs","tests/cn-cards/machine-effects.test.mjs"],"tier":"machine"},"kind":"pokemon","mechanics":{"abilities":[],"attacks":[{"attackId":"cn:machine:pokemon:xiang-ri-zhong-zi:2f1a99cc:a1","cost":["Grass"],"effects":[{"effectId":"cn:machine:pokemon:xiang-ri-zhong-zi:2f1a99cc:a1:heal","handlerId":"cn.heal@1","parameters":{"amount":10,"target":"self"},"sourceOfTruth":[{"kind":"card-library","sourceId":"library:SM-P/019_SM-P"}]}],"name":"寄生种子","printedDamage":{"operator":"fixed","value":10},"sourceOfTruth":[{"kind":"card-library","sourceId":"library:SM-P/019_SM-P"}]}],"effects":[],"evolvesFrom":null,"hp":50,"prizeCount":1,"resistance":null,"retreatCost":1,"ruleBox":false,"stage":"basic","tags":[],"types":["Grass"],"weakness":{"operation":"multiply","type":"Fire","value":2}},"name":"向日种子","nameKey":"xiang-ri-zhong-zi","ruleset":{"region":"CN","version":"V20261019"},"schemaVersion":"1.0.0","sourceOfTruth":[{"kind":"card-library","sourceId":"library:SM-P/019_SM-P"}]}],"printings":[{"definitionBindings":[{"definitionId":"cn:machine:pokemon:xiang-ri-zhong-zi:2f1a99cc","ruleset":{"region":"CN","version":"V20261019"},"sourceOfTruth":[{"kind":"card-library","sourceId":"library:SM-P/019_SM-P"}]}],"game":"tcg","identityReview":"machine","language":"zh-Hans","metadataRefs":[{"id":"library_v1:zh-Hans/SM-P/019_SM-P","provider":"other","revision":"image-sha256:ca8993f936d5794a5f84a01076e662236973827cac4c05fb55ad1b8d88953cec"}],"number":"019/SM-P","printingId":"zh-Hans:SM-P:019/SM-P","regulationMark":"C","releasedOn":"2022-10-28","schemaVersion":"1.0.0","series":"sun-moon","setCode":"SM-P"}],"schemaVersion":"2.0.0","setCode":"SM-P","shardId":"SM-P","sources":{"library:SM-P/019_SM-P":{"kind":"card-library","locator":"library_v1 zh-Hans/SM-P/019_SM-P：卡面各字段由两个视觉模型读本机卡图，与 MIK、52Poké 文字逐字段核对（机器实现，未经人工逐张审核）","sourceId":"library:SM-P/019_SM-P","url":"https://wiki.52poke.com/index.php?curid=156539"}}}
