{"definitions":[{"deckLimits":{"groups":[],"sameName":4},"definitionId":"cn:machine:pokemon:yuan-ying-wa-wa:3ece5064","implementation":{"status":"verified","testIds":["tests/cn-cards/machine.test.mjs"],"tier":"machine"},"kind":"pokemon","mechanics":{"abilities":[],"attacks":[{"attackId":"cn:machine:pokemon:yuan-ying-wa-wa:3ece5064:a1","cost":["Colorless"],"effects":[],"name":"头锤","printedDamage":{"operator":"fixed","value":10},"sourceOfTruth":[{"kind":"card-library","sourceId":"library:CSM1aC/039_151"}]},{"attackId":"cn:machine:pokemon:yuan-ying-wa-wa:3ece5064:a2","cost":["Psychic","Colorless"],"effects":[],"name":"磷火","printedDamage":{"operator":"fixed","value":20},"sourceOfTruth":[{"kind":"card-library","sourceId":"library:CSM1aC/039_151"}]}],"effects":[],"evolvesFrom":null,"hp":60,"prizeCount":1,"resistance":{"type":"Fighting","value":20},"retreatCost":1,"ruleBox":false,"stage":"basic","tags":[],"types":["Psychic"],"weakness":{"operation":"multiply","type":"Darkness","value":2}},"name":"怨影娃娃","nameKey":"yuan-ying-wa-wa","ruleset":{"region":"CN","version":"V20261019"},"schemaVersion":"1.0.0","sourceOfTruth":[{"kind":"card-library","sourceId":"library:CSM1aC/039_151"}]},{"deckLimits":{"groups":[],"sameName":4},"definitionId":"cn:machine:trainer:zhu-lan:4fcab306","implementation":{"status":"verified","testIds":["tests/cn-cards/machine.test.mjs","tests/cn-cards/machine-effects.test.mjs"],"tier":"machine"},"kind":"trainer","mechanics":{"category":"supporter","effects":[{"effectId":"cn:machine:trainer:zhu-lan:4fcab306:hand-deck-draw","handlerId":"cn.handDeckDraw@1","parameters":{"opponentDraw":0,"ownDraw":6,"side":"own"},"sourceOfTruth":[{"kind":"card-library","sourceId":"library:CSM1cC/141"}]}]},"name":"竹兰","nameKey":"zhu-lan","ruleset":{"region":"CN","version":"V20261019"},"schemaVersion":"1.0.0","sourceOfTruth":[{"kind":"card-library","sourceId":"library:CSM1cC/141"}]},{"deckLimits":{"groups":[],"sameName":4},"definitionId":"cn:trainer:judge","implementation":{"status":"verified","testIds":["tests/cn-cards/csvh1c-pikachu.test.mjs"]},"kind":"trainer","mechanics":{"category":"supporter","effects":[{"effectId":"cn:trainer:judge:hand-deck-draw","handlerId":"cn.handDeckDraw@1","parameters":{"opponentDraw":4,"ownDraw":4,"side":"both"},"sourceOfTruth":[{"kind":"official-card","sourceId":"cn-card-face:CSVH1C:051-059"}]}]},"name":"裁判","nameKey":"judge","ruleset":{"region":"CN","version":"V20261019"},"schemaVersion":"1.0.0","sourceOfTruth":[{"kind":"official-card","sourceId":"cn-card-face:CSVH1C:051-059"}]},{"deckLimits":{"groups":[],"sameName":4},"definitionId":"cn:trainer:switch","implementation":{"status":"verified","testIds":["tests/cn-cards/csvh1c-pikachu.test.mjs"]},"kind":"trainer","mechanics":{"category":"item","effects":[{"effectId":"cn:trainer:switch:switch","handlerId":"cn.switch@1","parameters":{"affected":"active","chooser":"self","side":"own"},"sourceOfTruth":[{"kind":"official-card","sourceId":"cn-card-face:CSVH1C:046-059"}]}]},"name":"宝可梦交替","nameKey":"switch","ruleset":{"region":"CN","version":"V20261019"},"schemaVersion":"1.0.0","sourceOfTruth":[{"kind":"official-card","sourceId":"cn-card-face:CSVH1C:046-059"}]}],"printings":[{"definitionBindings":[{"definitionId":"cn:machine:pokemon:yuan-ying-wa-wa:3ece5064","ruleset":{"region":"CN","version":"V20261019"},"sourceOfTruth":[{"kind":"card-library","sourceId":"library:CSMPeC/003_021"}]}],"game":"tcg","identityReview":"machine","language":"zh-Hans","metadataRefs":[{"id":"library_v1:zh-Hans/CSMPeC/003_021","provider":"other","revision":"image-sha256:e27d82a3544382c0c21646b465425e21d91212827fd478af6a2e91bff63aab89"}],"number":"003/021","printingId":"zh-Hans:CSMPeC:003/021","regulationMark":"B","releasedOn":"2023-04-15","schemaVersion":"1.0.0","series":"sun-moon","setCode":"CSMPeC"},{"definitionBindings":[{"definitionId":"cn:trainer:switch","ruleset":{"region":"CN","version":"V20261019"},"sourceOfTruth":[{"kind":"card-library","sourceId":"library:CSMPeC/011_021"}]}],"game":"tcg","identityReview":"machine","language":"zh-Hans","metadataRefs":[{"id":"library_v1:zh-Hans/CSMPeC/011_021","provider":"other","revision":"image-sha256:26e807f01e773bd7be5f0fcdb5b3cef1daba2aad1b434c5aa2f995b3797a0c10"}],"number":"011/021","printingId":"zh-Hans:CSMPeC:011/021","regulationMark":"A","releasedOn":"2023-04-15","schemaVersion":"1.0.0","series":"sun-moon","setCode":"CSMPeC"},{"definitionBindings":[{"definitionId":"cn:trainer:judge","ruleset":{"region":"CN","version":"V20261019"},"sourceOfTruth":[{"kind":"card-library","sourceId":"library:CSMPeC/019"}]}],"game":"tcg","identityReview":"machine","language":"zh-Hans","metadataRefs":[{"id":"library_v1:zh-Hans/CSMPeC/019","provider":"other","revision":"image-sha256:fbc99322089f7fc3b90ae6f904618dbc2280f0328abd7b32ac9d6575715fd9c5"}],"number":"019","printingId":"zh-Hans:CSMPeC:019","regulationMark":"B","releasedOn":"2023-04-15","schemaVersion":"1.0.0","series":"sun-moon","setCode":"CSMPeC"},{"definitionBindings":[{"definitionId":"cn:machine:trainer:zhu-lan:4fcab306","ruleset":{"region":"CN","version":"V20261019"},"sourceOfTruth":[{"kind":"card-library","sourceId":"library:CSMPeC/020"}]}],"game":"tcg","identityReview":"machine","language":"zh-Hans","metadataRefs":[{"id":"library_v1:zh-Hans/CSMPeC/020","provider":"other","revision":"image-sha256:ae400f3fa58c0866247e5fe4a48b1393f1302d125b89c22845aaa2a2e08ea989"}],"number":"020","printingId":"zh-Hans:CSMPeC:020","regulationMark":"B","releasedOn":"2023-04-15","schemaVersion":"1.0.0","series":"sun-moon","setCode":"CSMPeC"}],"schemaVersion":"2.0.0","setCode":"CSMPeC","shardId":"CSMPeC","sources":{"cn-card-face:CSVH1C:046-059":{"kind":"official-card","locator":"宝可梦卡牌 嗨皮组合 皮卡丘&皮皮&草苗龟&索财灵 CSVH1C 046/059 宝可梦交替：卡面文字逐项核对本机卡图 library_v1/zh-Hans/CSVH1C/046/CSVH1C_046.png（SHA-256 eac5921eb7513c75b0dc576d4ad1a68748c02753f72ca3a8ab3283fd67887b53，图源 https://tcg.mik.moe/static/img/CSVH1C/046.png）及同目录 metadata.json；官方商品页确认所属商品「宝可梦卡牌 嗨皮组合 皮卡丘&皮皮&草苗龟&索财灵」与发售日 2025-01-17。","observedOn":"2026-10-21","sourceId":"cn-card-face:CSVH1C:046-059","url":"https://www.pokemon.cn/tcg/product/15585.html"},"cn-card-face:CSVH1C:051-059":{"kind":"official-card","locator":"宝可梦卡牌 嗨皮组合 皮卡丘&皮皮&草苗龟&索财灵 CSVH1C 051/059 裁判：卡面文字逐项核对本机卡图 library_v1/zh-Hans/CSVH1C/051_059/CSVH1C_051_059.png（SHA-256 b6faf8371d3206c1aca210173e1881fe8ec0dbdd921537c91a59af162a3f83e6，图源 https://tcg.mik.moe/static/img/CSVH1C/051.png）及同目录 metadata.json；官方商品页确认所属商品「宝可梦卡牌 嗨皮组合 皮卡丘&皮皮&草苗龟&索财灵」与发售日 2025-01-17。","observedOn":"2026-10-21","sourceId":"cn-card-face:CSVH1C:051-059","url":"https://www.pokemon.cn/tcg/product/15585.html"},"library:CSM1aC/039_151":{"kind":"card-library","locator":"library_v1 zh-Hans/CSM1aC/039_151：卡面各字段由两个视觉模型读本机卡图，与 MIK、52Poké 文字逐字段核对（机器实现，未经人工逐张审核）","sourceId":"library:CSM1aC/039_151","url":"https://tcg.mik.moe/cards/CSM1aC/039"},"library:CSM1cC/141":{"kind":"card-library","locator":"library_v1 zh-Hans/CSM1cC/141：卡面各字段由两个视觉模型读本机卡图，与 MIK、52Poké 文字逐字段核对（机器实现，未经人工逐张审核）","sourceId":"library:CSM1cC/141","url":"https://tcg.mik.moe/cards/CSM1cC/141"},"library:CSMPeC/003_021":{"kind":"card-library","locator":"library_v1 zh-Hans/CSMPeC/003_021：卡面各字段由两个视觉模型读本机卡图，与 MIK、52Poké 文字逐字段核对（机器实现，未经人工逐张审核）","sourceId":"library:CSMPeC/003_021","url":"https://tcg.mik.moe/cards/CSMPeC/003"},"library:CSMPeC/011_021":{"kind":"card-library","locator":"library_v1 zh-Hans/CSMPeC/011_021：卡面各字段由两个视觉模型读本机卡图，与 MIK、52Poké 文字逐字段核对（机器实现，未经人工逐张审核）","sourceId":"library:CSMPeC/011_021","url":"https://tcg.mik.moe/cards/CSMPeC/011"},"library:CSMPeC/019":{"kind":"card-library","locator":"library_v1 zh-Hans/CSMPeC/019：卡面各字段由两个视觉模型读本机卡图，与 MIK、52Poké 文字逐字段核对（机器实现，未经人工逐张审核）","sourceId":"library:CSMPeC/019","url":"https://tcg.mik.moe/cards/CSMPeC/019"},"library:CSMPeC/020":{"kind":"card-library","locator":"library_v1 zh-Hans/CSMPeC/020：卡面各字段由两个视觉模型读本机卡图，与 MIK、52Poké 文字逐字段核对（机器实现，未经人工逐张审核）","sourceId":"library:CSMPeC/020","url":"https://tcg.mik.moe/cards/CSMPeC/020"}}}
